{
  "nodal_version": "1",
  "id": "01990000-0000-7000-8000-000000000003",
  "nodes": {
    "01990000-0000-7000-8000-000000000001": {
      "type": "diffusion.MiniMaxH3",
      "inputs": {
        "model_path": "",
        "prompt": "A cat looks out of a sunlit window. Slow camera push in. Quiet birdsong.",
        "width": 960,
        "height": 544,
        "num_frames": 124,
        "steps": 30,
        "seed": 7,
        "memory_profile": "int8_offload"
      },
      "meta": {
        "title": "MiniMax H3 영상",
        "notes": "원격 서버의 NODAL_H3_MODEL을 지정한다. 124프레임, 약 5.17초. docs/minimax-h3.md 참고."
      }
    }
  },
  "outputs": ["01990000-0000-7000-8000-000000000001"],
  "ui": {
    "01990000-0000-7000-8000-000000000001": {
      "pos": [400, 80]
    }
  }
}
