{
  "nodal_version": "1",
  "id": "1e235011-0000-4000-8000-000000000000",
  "nodes": {
    "1e235011-0000-4000-8000-000000000001": {
      "type": "image.Load",
      "inputs": {
        "path": "C:/Users/nexta/Desktop/nodal/output/reel-qwen-shotmatch/frames/shot-11-camera.png"
      }
    },
    "1e235011-0000-4000-8000-000000000002": {
      "type": "image.Load",
      "inputs": {
        "path": "C:/Users/nexta/Desktop/nodal/output/reel-qwen-shotmatch/frames/shot-11-end-final.png"
      }
    },
    "1e235011-0000-4000-8000-000000000003": {
      "type": "diffusion.MiniMaxH3",
      "inputs": {
        "model_path": "C:/Users/nexta/Desktop/nodal/models/MiniMax-H3-Pruned",
        "first_frame": {
          "$link": [
            "1e235011-0000-4000-8000-000000000001",
            "image"
          ]
        },
        "prompt": "A photorealistic Korean romantic comedy. Follow the supplied FIRST FRAME's exact shot composition, lens, faces, clothes and vintage setting. This is ONE SHOT, not an entire montage. One continuous final TWO-SHOT in the vintage timber room. Man seated LEFT on olive sofa, woman standing RIGHT in ivory lace camisole/peplum and dark jeans, low carved table and yellow mug between them. Preserve their exact approved faces, relative adult scale, hairstyle and furniture. The camera pulls smoothly and slowly BACK for the whole ten seconds, ending at the supplied last frame's wider room view. No internal cuts. She makes small explanatory open-hand gestures, he stays seated and looks up at her. Natural young adult Korean female voice for woman; warm young adult Korean male voice for man, consistent with earlier shots. Alternating dialogue, no overlap: woman from 0.10 to 3.00 seconds '아니 뭐 컬러가 이쁘다. 이런 표현 있잖아!'; man from 3.10 to 4.15 '컬러가 귀여워.'; woman from 4.25 to 6.35 '컬러 조합이 어떻다. 이런 거!'; man from 6.45 to 7.50 '조합이 귀여워.'; woman from 7.65 to 9.10 '아이씨 그거 말고!' Only the active speaker's lips move. Natural brisk comic delivery, clear words, no invented extra dialogue. Preserve two normal arms per person and feet on floor. End with her playful exasperation and his affectionate reaction.\nPreserve facial identity throughout, natural adult anatomy, realistic skin, consistent soft warm window lighting. Only the specifically described slow camera move. No shot changes, no extra people, no narrator, no music. Very quiet indoor ambience under requested speech. No captions, subtitles, title, text, logos or watermark in any frame. Preserve the exact visible framing; retain this two-shot throughout the pull-back.",
        "seed": 923511,
        "steps": 20,
        "width": 1024,
        "height": 576,
        "num_frames": 243,
        "memory_profile": "pruned_convrot_int8_offload",
        "last_frame": {
          "$link": [
            "1e235011-0000-4000-8000-000000000002",
            "image"
          ]
        }
      }
    }
  },
  "outputs": [
    "1e235011-0000-4000-8000-000000000003"
  ]
}