{
  "nodal_version": "1",
  "id": "1e235001-0000-4000-8000-000000000000",
  "nodes": {
    "1e235001-0000-4000-8000-000000000001": {
      "type": "image.Load",
      "inputs": {
        "path": "C:/Users/nexta/Desktop/nodal/output/reel-qwen-shotmatch/frames/shot-01.png"
      }
    },
    "1e235001-0000-4000-8000-000000000003": {
      "type": "diffusion.MiniMaxH3",
      "inputs": {
        "model_path": "C:/Users/nexta/Desktop/nodal/models/MiniMax-H3-Pruned",
        "first_frame": {
          "$link": [
            "1e235001-0000-4000-8000-000000000001",
            "image"
          ]
        },
        "prompt": "A photorealistic Korean romantic comedy. Follow the supplied FIRST FRAME's exact shot composition, lens, faces, clothes and vintage setting. This is ONE SHOT, not an entire montage. Single woman-only medium shot beside the window, slightly low camera, WHITE fitted short-sleeved blouse, dark jeans and burgundy shoulder bag. Preserve the exact first-frame woman and room. She casually shows the outfit with a small shoulder turn and lightly touches the waistband, then looks toward the off-screen seated man on screen LEFT. In a natural young adult FEMALE Korean voice she says briskly, as one conversational thought beginning at 0.10 seconds and finishing by 3.85 seconds: '내일 우리 놀러 갈 때 입을 옷. 어떤 게 나은지 봐줘! 어때?' Her lips match her words. After the line she holds an expectant playful look. No man enters, no male voice.\nPreserve facial identity throughout, natural adult anatomy, realistic skin, consistent soft warm window lighting. Locked camera, no zoom or pan or reframing. No shot changes, no extra people, no narrator, no music. Very quiet indoor ambience under requested speech. No captions, subtitles, title, text, logos or watermark in any frame. Preserve the exact visible framing; NEVER replace this shot with a wide two-shot.",
        "seed": 923501,
        "steps": 20,
        "width": 1024,
        "height": 576,
        "num_frames": 124,
        "memory_profile": "pruned_convrot_int8_offload"
      }
    }
  },
  "outputs": [
    "1e235001-0000-4000-8000-000000000003"
  ]
}